{
  "benchmark_version": "2",
  "condition": "garden_off",
  "cost_usd": 0.820594,
  "diff_size": {
    "files_changed": 2,
    "lines_added": 114,
    "lines_removed": 22
  },
  "harness": "codex",
  "models": {
    "main": "gpt-5.6-sol",
    "subagents": [
      "gpt-5.6-terra",
      "gpt-5.6-luna"
    ]
  },
  "pass": true,
  "provenance": {
    "cli_version": "codex-cli 0.144.5",
    "fixture_hash": "e06303c30bb871da1509f22ed9476372a44e599eb82429e35c5a6537d8e818d4",
    "model_ids": [
      "gpt-5.6-sol",
      "gpt-5.6-terra",
      "gpt-5.6-luna"
    ],
    "prompt_hash": "cf6b0a0a7b214935a530cd4e7dfd75a9e799cb16f0c79b5589ea1780361247eb",
    "timestamp": "2026-07-18T21:29:43.163345Z"
  },
  "raw_telemetry_ref": "raw/codex__garden_off__T3__r2.jsonl",
  "repetition": 2,
  "schema_version": "2",
  "task_id": "T3",
  "tokens": {
    "cache": 269824,
    "input": 30697,
    "output": 6095
  },
  "wall_clock_seconds": 141.4826436303556
}
