{
  "benchmark_version": "2",
  "condition": "garden_on",
  "cost_usd": 1.6409745,
  "diff_size": {
    "files_changed": 20,
    "lines_added": 140,
    "lines_removed": 19
  },
  "harness": "claude_code",
  "models": {
    "main": "claude-opus-4-8",
    "subagents": [
      "claude-sonnet-5"
    ]
  },
  "pass": true,
  "provenance": {
    "cli_version": "2.1.215 (Claude Code)",
    "fixture_hash": "e06303c30bb871da1509f22ed9476372a44e599eb82429e35c5a6537d8e818d4",
    "model_ids": [
      "claude-opus-4-8",
      "claude-sonnet-5"
    ],
    "prompt_hash": "cf6b0a0a7b214935a530cd4e7dfd75a9e799cb16f0c79b5589ea1780361247eb",
    "timestamp": "2026-07-19T07:59:38.064910Z"
  },
  "raw_telemetry_ref": "raw/claude_code__garden_on__T3__r1.json",
  "repetition": 1,
  "schema_version": "2",
  "task_id": "T3",
  "tokens": {
    "cache": 650573,
    "input": 16,
    "output": 8865
  },
  "wall_clock_seconds": 129.96039795316756
}
